autobench-main/logs/cutlass/GEMM-1024-1024-1024-16-f16-f16.csv
Problem,Provider,OperationKind,Operation,Disposition,Status,gemm_kind,split_k_mode,m,n,k,A,B,C,alpha,beta,split_k_slices,batch_count,op_class,accum,cta_m,cta_n,cta_k,stages,warps_m,warps_n,warps_k,inst_m,inst_n,inst_k,min_cc,max_cc,Bytes,Flops,Flops/Byte,Runtime,GB/s,GFLOPs
1,CUTLASS,gemm,cutlass_simt_hgemm_256x128_8x2_tn_align1,passed,success,universal,serial,1024,1024,1024,f16:row,f16:column,f16:column,1,0,1,16,simt,f16,256,128,8,2,4,2,1,1,1,1,50,1024,100663296,34393292800,341,1.18458,79.1417,29034.1
1,CUTLASS,gemm,cutlass_tensorop_h1688gemm_256x128_32x2_tn_align8,passed,success,universal,serial,1024,1024,1024,f16:row,f16:column,f16:column,1,0,1,16,tensorop,f16,256,128,32,2,4,2,1,16,8,8,75,1024,100663296,34393292800,341,0.324833,288.61,105880
1,CUTLASS,gemm,cutlass_tensorop_h16816gemm_256x128_32x3_tn_align8,passed,success,universal,serial,1024,1024,1024,f16:row,f16:column,f16:column,1,0,1,16,tensorop,f16,256,128,32,3,4,2,1,16,8,16,80,1024,100663296,34393292800,341,0.284948,329.007,120700
