autobench-main/logs/TVM/GMM-4096-1/float16/database_tuning_record.json
[0,[[[["GetBlock",[],["Z","main"],["b0"]],["GetBlock",[],["root","main"],["b1"]],["Annotate",["b0","\"SSSRRSRS\""],["meta_schedule.tiling_structure"],[]],["GetLoops",["b0"],[],["l2","l3","l4","l5"]],["SamplePerfectTile",["l2"],[5,64],["v6","v7","v8","v9","v10"]],["Split",["l2","v6","v7","v8","v9","v10"],[],["l11","l12","l13","l14","l15"]],["SamplePerfectTile",["l3"],[5,64],["v16","v17","v18","v19","v20"]],["Split",["l3","v16","v17","v18","v19","v20"],[],["l21","l22","l23","l24","l25"]],["SamplePerfectTile",["l4"],[5,64],["v26","v27","v28","v29","v30"]],["Split",["l4","v26","v27","v28","v29","v30"],[],["l31","l32","l33","l34","l35"]],["SamplePerfectTile",["l5"],[3,64],["v36","v37","v38"]],["Split",["l5","v36","v37","v38"],[],["l39","l40","l41"]],["Reorder",["l11","l21","l31","l12","l22","l32","l13","l23","l33","l39","l40","l14","l24","l34","l41","l15","l25","l35"],[],[]],["Fuse",["l11","l21","l31"],[],["l42"]],["Bind",["l42"],["blockIdx.x"],[]],["Fuse",["l12","l22","l32"],[],["l43"]],["Bind",["l43"],["vthread.x"],[]],["Fuse",["l13","l23","l33"],[],["l44"]],["Bind",["l44"],["threadIdx.x"],[]],["Annotate",["b0",32],["meta_schedule.thread_extent_low_inclusive"],[]],["Annotate",["b0",1024],["meta_schedule.thread_extent_high_inclusive"],[]],["CacheWrite",["b0"],[0,"local"],["b45"]],["ReverseComputeAt",["b45","l44"],[true],[]],["CacheRead",["b0"],[0,"shared"],["b46"]],["ComputeAt",["b46","l39"],[true],[]],["GetLoops",["b46"],[],["l47","l48","l49","l50","l51","l52","l53"]],["Fuse",["l51","l52","l53"],[],["l54"]],["SampleCategorical",[],[[1,2,3,4],[0.25000000000000000000,0.25000000000000000000,0.25000000000000000000,0.25000000000000000000]],["v55"]],["Annotate",["b46","v55"],["meta_schedule.cooperative_fetch"],[]],["CacheRead",["b0"],[1,"shared"],["b56"]],["ComputeAt",["b56","l39"],[true],[]],["GetLoops",["b56"],[],["l57","l58","l59","l60","l61","l62","l63"]],["Fuse",["l61","l62","l63"],[],["l64"]],["SampleCategorical",[],[[1,2,3,4],[0.25000000000000000000,0.25000000000000000000,0.25000000000000000000,0.25000000000000000000]],["v65"]],["Annotate",["b56","v65"],["meta_schedule.cooperative_fetch"],[]],["Annotate",["l39",[1,1,1]],["software_pipeline_stage"],[]],["Annotate",["l39",[0,1,2]],["software_pipeline_order"],[]],["SampleCategorical",[],[[0,16,64,512,1024],[0.20000000000000001110,0.20000000000000001110,0.20000000000000001110,0.20000000000000001110,0.20000000000000001110]],["v66"]],["Annotate",["b1","v66"],["meta_schedule.unroll_explicit"],[]],["EnterPostproc",[],[],[]],["Unannotate",["b46"],["meta_schedule.cooperative_fetch"],[]],["GetLoops",["b46"],[],["l67","l68","l69","l70","l71"]],["Split",["l71","None",64],[],["l72","l73"]],["Bind",["l73"],["threadIdx.x"],[]],["Unannotate",["b56"],["meta_schedule.cooperative_fetch"],[]],["GetLoops",["b56"],[],["l74","l75","l76","l77","l78"]],["Split",["l78","None",64,2],[],["l79","l80","l81"]],["Vectorize",["l81"],[],[]],["Bind",["l80"],["threadIdx.x"],[]],["GetBlock",[],["root","main"],["b82"]],["Unannotate",["b82"],["meta_schedule.unroll_explicit"],[]],["GetChildBlocks",["b82"],[],["b83","b84","b85","b86"]],["GetLoops",["b83"],[],["l87","l88","l89","l90","l91","l92"]],["GetLoops",["b84"],[],["l93","l94","l95","l96","l97","l98","l99"]],["GetLoops",["b85"],[],["l100","l101","l102","l103","l104","l105","l106","l107","l108","l109","l110","l111"]],["GetLoops",["b86"],[],["l112","l113","l114","l115","l116","l117"]],["GetBlock",[],["Z","main"],["b118"]],["GetLoops",["b118"],[],["l119","l120","l121","l122","l123","l124","l125","l126","l127","l128","l129","l130"]],["DecomposeReduction",["b118","l122"],[],["b131"]]],[[4,[1,1,1,1,1]],[6,[16,2,32,2,2]],[8,[4,32,2,1,16]],[10,[1024,1,4]],[27,0],[33,1],[37,0]]],[0.45609831966666664060],{"arch":"sm_86","keys":["cuda","gpu"],"kind":"cuda","max_num_threads":1024,"max_shared_memory_per_block":49152,"max_threads_per_block":1024,"registers_per_block":65536,"tag":"","thread_warp_size":32},[["TENSOR","float16",[1,4096,4096]],["TENSOR","float16",[1,4096,4096]],["TENSOR","float16",[1,4096,4096]]]]]
[0,[[[["GetBlock",[],["Z","main"],["b0"]],["GetBlock",[],["root","main"],["b1"]],["Annotate",["b0","\"SSSRRSRS\""],["meta_schedule.tiling_structure"],[]],["GetLoops",["b0"],[],["l2","l3","l4","l5"]],["SamplePerfectTile",["l2"],[5,64],["v6","v7","v8","v9","v10"]],["Split",["l2","v6","v7","v8","v9","v10"],[],["l11","l12","l13","l14","l15"]],["SamplePerfectTile",["l3"],[5,64],["v16","v17","v18","v19","v20"]],["Split",["l3","v16","v17","v18","v19","v20"],[],["l21","l22","l23","l24","l25"]],["SamplePerfectTile",["l4"],[5,64],["v26","v27","v28","v29","v30"]],["Split",["l4","v26","v27","v28","v29","v30"],[],["l31","l32","l33","l34","l35"]],["SamplePerfectTile",["l5"],[3,64],["v36","v37","v38"]],["Split",["l5","v36","v37","v38"],[],["l39","l40","l41"]],["Reorder",["l11","l21","l31","l12","l22","l32","l13","l23","l33","l39","l40","l14","l24","l34","l41","l15","l25","l35"],[],[]],["Fuse",["l11","l21","l31"],[],["l42"]],["Bind",["l42"],["blockIdx.x"],[]],["Fuse",["l12","l22","l32"],[],["l43"]],["Bind",["l43"],["vthread.x"],[]],["Fuse",["l13","l23","l33"],[],["l44"]],["Bind",["l44"],["threadIdx.x"],[]],["Annotate",["b0",32],["meta_schedule.thread_extent_low_inclusive"],[]],["Annotate",["b0",1024],["meta_schedule.thread_extent_high_inclusive"],[]],["CacheWrite",["b0"],[0,"local"],["b45"]],["ReverseComputeAt",["b45","l44"],[true],[]],["CacheRead",["b0"],[0,"shared"],["b46"]],["ComputeAt",["b46","l39"],[true],[]],["GetLoops",["b46"],[],["l47","l48","l49","l50","l51","l52","l53"]],["Fuse",["l51","l52","l53"],[],["l54"]],["SampleCategorical",[],[[1,2,3,4],[0.25000000000000000000,0.25000000000000000000,0.25000000000000000000,0.25000000000000000000]],["v55"]],["Annotate",["b46","v55"],["meta_schedule.cooperative_fetch"],[]],["CacheRead",["b0"],[1,"shared"],["b56"]],["ComputeAt",["b56","l39"],[true],[]],["GetLoops",["b56"],[],["l57","l58","l59","l60","l61","l62","l63"]],["Fuse",["l61","l62","l63"],[],["l64"]],["SampleCategorical",[],[[1,2,3,4],[0.25000000000000000000,0.25000000000000000000,0.25000000000000000000,0.25000000000000000000]],["v65"]],["Annotate",["b56","v65"],["meta_schedule.cooperative_fetch"],[]],["Annotate",["l39",[1,1,1]],["software_pipeline_stage"],[]],["Annotate",["l39",[0,1,2]],["software_pipeline_order"],[]],["SampleCategorical",[],[[0,16,64,512,1024],[0.20000000000000001110,0.20000000000000001110,0.20000000000000001110,0.20000000000000001110,0.20000000000000001110]],["v66"]],["Annotate",["b1","v66"],["meta_schedule.unroll_explicit"],[]],["EnterPostproc",[],[],[]],["Unannotate",["b46"],["meta_schedule.cooperative_fetch"],[]],["GetLoops",["b46"],[],["l67","l68","l69","l70","l71"]],["Split",["l71","None",128,2],[],["l72","l73","l74"]],["Vectorize",["l74"],[],[]],["Bind",["l73"],["threadIdx.x"],[]],["Unannotate",["b56"],["meta_schedule.cooperative_fetch"],[]],["GetLoops",["b56"],[],["l75","l76","l77","l78","l79"]],["Split",["l79","None",128,4],[],["l80","l81","l82"]],["Vectorize",["l82"],[],[]],["Bind",["l81"],["threadIdx.x"],[]],["GetBlock",[],["root","main"],["b83"]],["Unannotate",["b83"],["meta_schedule.unroll_explicit"],[]],["GetChildBlocks",["b83"],[],["b84","b85","b86","b87"]],["GetLoops",["b84"],[],["l88","l89","l90","l91","l92","l93","l94"]],["GetLoops",["b85"],[],["l95","l96","l97","l98","l99","l100","l101"]],["GetLoops",["b86"],[],["l102","l103","l104","l105","l106","l107","l108","l109","l110","l111","l112","l113"]],["GetLoops",["b87"],[],["l114","l115","l116","l117","l118","l119"]],["GetBlock",[],["Z","main"],["b120"]],["GetLoops",["b120"],[],["l121","l122","l123","l124","l125","l126","l127","l128","l129","l130","l131","l132"]],["DecomposeReduction",["b120","l124"],[],["b133"]]],[[4,[1,1,1,1,1]],[6,[4,8,32,1,4]],[8,[4,64,4,4,1]],[10,[4096,1,1]],[27,1],[33,3],[37,0]]],[1.9443620580000000597],{"arch":"sm_86","keys":["cuda","gpu"],"kind":"cuda","max_num_threads":1024,"max_shared_memory_per_block":49152,"max_threads_per_block":1024,"registers_per_block":65536,"tag":"","thread_warp_size":32},[["TENSOR","float16",[1,4096,4096]],["TENSOR","float16",[1,4096,4096]],["TENSOR","float16",[1,4096,4096]]]]]
[0,[[[["GetBlock",[],["Z","main"],["b0"]],["GetBlock",[],["root","main"],["b1"]],["Annotate",["b0","\"SSSRRSRS\""],["meta_schedule.tiling_structure"],[]],["GetLoops",["b0"],[],["l2","l3","l4","l5"]],["SamplePerfectTile",["l2"],[5,64],["v6","v7","v8","v9","v10"]],["Split",["l2","v6","v7","v8","v9","v10"],[],["l11","l12","l13","l14","l15"]],["SamplePerfectTile",["l3"],[5,64],["v16","v17","v18","v19","v20"]],["Split",["l3","v16","v17","v18","v19","v20"],[],["l21","l22","l23","l24","l25"]],["SamplePerfectTile",["l4"],[5,64],["v26","v27","v28","v29","v30"]],["Split",["l4","v26","v27","v28","v29","v30"],[],["l31","l32","l33","l34","l35"]],["SamplePerfectTile",["l5"],[3,64],["v36","v37","v38"]],["Split",["l5","v36","v37","v38"],[],["l39","l40","l41"]],["Reorder",["l11","l21","l31","l12","l22","l32","l13","l23","l33","l39","l40","l14","l24","l34","l41","l15","l25","l35"],[],[]],["Fuse",["l11","l21","l31"],[],["l42"]],["Bind",["l42"],["blockIdx.x"],[]],["Fuse",["l12","l22","l32"],[],["l43"]],["Bind",["l43"],["vthread.x"],[]],["Fuse",["l13","l23","l33"],[],["l44"]],["Bind",["l44"],["threadIdx.x"],[]],["Annotate",["b0",32],["meta_schedule.thread_extent_low_inclusive"],[]],["Annotate",["b0",1024],["meta_schedule.thread_extent_high_inclusive"],[]],["CacheWrite",["b0"],[0,"local"],["b45"]],["ReverseComputeAt",["b45","l44"],[true],[]],["CacheRead",["b0"],[0,"shared"],["b46"]],["ComputeAt",["b46","l39"],[true],[]],["GetLoops",["b46"],[],["l47","l48","l49","l50","l51","l52","l53"]],["Fuse",["l51","l52","l53"],[],["l54"]],["SampleCategorical",[],[[1,2,3,4],[0.25000000000000000000,0.25000000000000000000,0.25000000000000000000,0.25000000000000000000]],["v55"]],["Annotate",["b46","v55"],["meta_schedule.cooperative_fetch"],[]],["CacheRead",["b0"],[1,"shared"],["b56"]],["ComputeAt",["b56","l39"],[true],[]],["GetLoops",["b56"],[],["l57","l58","l59","l60","l61","l62","l63"]],["Fuse",["l61","l62","l63"],[],["l64"]],["SampleCategorical",[],[[1,2,3,4],[0.25000000000000000000,0.25000000000000000000,0.25000000000000000000,0.25000000000000000000]],["v65"]],["Annotate",["b56","v65"],["meta_schedule.cooperative_fetch"],[]],["Annotate",["l39",[1,1,1]],["software_pipeline_stage"],[]],["Annotate",["l39",[0,1,2]],["software_pipeline_order"],[]],["SampleCategorical",[],[[0,16,64,512,1024],[0.20000000000000001110,0.20000000000000001110,0.20000000000000001110,0.20000000000000001110,0.20000000000000001110]],["v66"]],["Annotate",["b1","v66"],["meta_schedule.unroll_explicit"],[]],["EnterPostproc",[],[],[]],["Unannotate",["b46"],["meta_schedule.cooperative_fetch"],[]],["GetLoops",["b46"],[],["l67","l68","l69","l70","l71"]],["Split",["l71","None",32,4],[],["l72","l73","l74"]],["Vectorize",["l74"],[],[]],["Bind",["l73"],["threadIdx.x"],[]],["Unannotate",["b56"],["meta_schedule.cooperative_fetch"],[]],["GetLoops",["b56"],[],["l75","l76","l77","l78","l79"]],["Split",["l79","None",32,4],[],["l80","l81","l82"]],["Vectorize",["l82"],[],[]],["Bind",["l81"],["threadIdx.x"],[]],["GetBlock",[],["root","main"],["b83"]],["Unannotate",["b83"],["meta_schedule.unroll_explicit"],[]],["GetChildBlocks",["b83"],[],["b84","b85","b86","b87"]],["GetLoops",["b84"],[],["l88","l89","l90","l91","l92","l93","l94"]],["GetLoops",["b85"],[],["l95","l96","l97","l98","l99","l100","l101"]],["GetLoops",["b86"],[],["l102","l103","l104","l105","l106","l107","l108","l109","l110","l111","l112","l113"]],["GetLoops",["b87"],[],["l114","l115","l116","l117","l118","l119"]],["GetBlock",[],["Z","main"],["b120"]],["GetLoops",["b120"],[],["l121","l122","l123","l124","l125","l126","l127","l128","l129","l130","l131","l132"]],["DecomposeReduction",["b120","l124"],[],["b133"]]],[[4,[1,1,1,1,1]],[6,[256,2,2,2,2]],[8,[1,8,16,8,4]],[10,[1024,4,1]],[27,3],[33,3],[37,0]]],[0.51147680266666661897],{"arch":"sm_86","keys":["cuda","gpu"],"kind":"cuda","max_num_threads":1024,"max_shared_memory_per_block":49152,"max_threads_per_block":1024,"registers_per_block":65536,"tag":"","thread_warp_size":32},[["TENSOR","float16",[1,4096,4096]],["TENSOR","float16",[1,4096,4096]],["TENSOR","float16",[1,4096,4096]]]]]
[0,[[[["GetBlock",[],["Z","main"],["b0"]],["GetBlock",[],["root","main"],["b1"]],["Annotate",["b0","\"SSSRRSRS\""],["meta_schedule.tiling_structure"],[]],["GetLoops",["b0"],[],["l2","l3","l4","l5"]],["SamplePerfectTile",["l2"],[5,64],["v6","v7","v8","v9","v10"]],["Split",["l2","v6","v7","v8","v9","v10"],[],["l11","l12","l13","l14","l15"]],["SamplePerfectTile",["l3"],[5,64],["v16","v17","v18","v19","v20"]],["Split",["l3","v16","v17","v18","v19","v20"],[],["l21","l22","l23","l24","l25"]],["SamplePerfectTile",["l4"],[5,64],["v26","v27","v28","v29","v30"]],["Split",["l4","v26","v27","v28","v29","v30"],[],["l31","l32","l33","l34","l35"]],["SamplePerfectTile",["l5"],[3,64],["v36","v37","v38"]],["Split",["l5","v36","v37","v38"],[],["l39","l40","l41"]],["Reorder",["l11","l21","l31","l12","l22","l32","l13","l23","l33","l39","l40","l14","l24","l34","l41","l15","l25","l35"],[],[]],["Fuse",["l11","l21","l31"],[],["l42"]],["Bind",["l42"],["blockIdx.x"],[]],["Fuse",["l12","l22","l32"],[],["l43"]],["Bind",["l43"],["vthread.x"],[]],["Fuse",["l13","l23","l33"],[],["l44"]],["Bind",["l44"],["threadIdx.x"],[]],["Annotate",["b0",32],["meta_schedule.thread_extent_low_inclusive"],[]],["Annotate",["b0",1024],["meta_schedule.thread_extent_high_inclusive"],[]],["CacheWrite",["b0"],[0,"local"],["b45"]],["ReverseComputeAt",["b45","l44"],[true],[]],["CacheRead",["b0"],[0,"shared"],["b46"]],["ComputeAt",["b46","l39"],[true],[]],["GetLoops",["b46"],[],["l47","l48","l49","l50","l51","l52","l53"]],["Fuse",["l51","l52","l53"],[],["l54"]],["SampleCategorical",[],[[1,2,3,4],[0.25000000000000000000,0.25000000000000000000,0.25000000000000000000,0.25000000000000000000]],["v55"]],["Annotate",["b46","v55"],["meta_schedule.cooperative_fetch"],[]],["CacheRead",["b0"],[1,"shared"],["b56"]],["ComputeAt",["b56","l39"],[true],[]],["GetLoops",["b56"],[],["l57","l58","l59","l60","l61","l62","l63"]],["Fuse",["l61","l62","l63"],[],["l64"]],["SampleCategorical",[],[[1,2,3,4],[0.25000000000000000000,0.25000000000000000000,0.25000000000000000000,0.25000000000000000000]],["v65"]],["Annotate",["b56","v65"],["meta_schedule.cooperative_fetch"],[]],["Annotate",["l39",[1,1,1]],["software_pipeline_stage"],[]],["Annotate",["l39",[0,1,2]],["software_pipeline_order"],[]],["SampleCategorical",[],[[0,16,64,512,1024],[0.20000000000000001110,0.20000000000000001110,0.20000000000000001110,0.20000000000000001110,0.20000000000000001110]],["v66"]],["Annotate",["b1","v66"],["meta_schedule.unroll_explicit"],[]],["EnterPostproc",[],[],[]],["Unannotate",["b46"],["meta_schedule.cooperative_fetch"],[]],["GetLoops",["b46"],[],["l67","l68","l69","l70","l71"]],["Split",["l71","None",1024,4],[],["l72","l73","l74"]],["Vectorize",["l74"],[],[]],["Bind",["l73"],["threadIdx.x"],[]],["Unannotate",["b56"],["meta_schedule.cooperative_fetch"],[]],["GetLoops",["b56"],[],["l75","l76","l77","l78","l79"]],["Split",["l79","None",1024,2],[],["l80","l81","l82"]],["Vectorize",["l82"],[],[]],["Bind",["l81"],["threadIdx.x"],[]],["GetBlock",[],["root","main"],["b83"]],["Unannotate",["b83"],["meta_schedule.unroll_explicit"],[]],["GetChildBlocks",["b83"],[],["b84","b85","b86","b87"]],["GetLoops",["b84"],[],["l88","l89","l90","l91","l92","l93","l94"]],["GetLoops",["b85"],[],["l95","l96","l97","l98","l99","l100","l101"]],["GetLoops",["b86"],[],["l102","l103","l104","l105","l106","l107","l108","l109","l110","l111","l112","l113"]],["GetLoops",["b87"],[],["l114","l115","l116","l117","l118","l119"]],["GetBlock",[],["Z","main"],["b120"]],["GetLoops",["b120"],[],["l121","l122","l123","l124","l125","l126","l127","l128","l129","l130","l131","l132"]],["DecomposeReduction",["b120","l124"],[],["b133"]]],[[4,[1,1,1,1,1]],[6,[8,32,16,1,1]],[8,[16,4,64,1,1]],[10,[2048,1,2]],[27,3],[33,1],[37,0]]],[0.055048671999999999882],{"arch":"sm_86","keys":["cuda","gpu"],"kind":"cuda","max_num_threads":1024,"max_shared_memory_per_block":49152,"max_threads_per_block":1024,"registers_per_block":65536,"tag":"","thread_warp_size":32},[["TENSOR","float16",[1,4096,4096]],["TENSOR","float16",[1,4096,4096]],["TENSOR","float16",[1,4096,4096]]]]]
[0,[[[["GetBlock",[],["Z","main"],["b0"]],["GetBlock",[],["root","main"],["b1"]],["Annotate",["b0","\"SSSRRSRS\""],["meta_schedule.tiling_structure"],[]],["GetLoops",["b0"],[],["l2","l3","l4","l5"]],["SamplePerfectTile",["l2"],[5,64],["v6","v7","v8","v9","v10"]],["Split",["l2","v6","v7","v8","v9","v10"],[],["l11","l12","l13","l14","l15"]],["SamplePerfectTile",["l3"],[5,64],["v16","v17","v18","v19","v20"]],["Split",["l3","v16","v17","v18","v19","v20"],[],["l21","l22","l23","l24","l25"]],["SamplePerfectTile",["l4"],[5,64],["v26","v27","v28","v29","v30"]],["Split",["l4","v26","v27","v28","v29","v30"],[],["l31","l32","l33","l34","l35"]],["SamplePerfectTile",["l5"],[3,64],["v36","v37","v38"]],["Split",["l5","v36","v37","v38"],[],["l39","l40","l41"]],["Reorder",["l11","l21","l31","l12","l22","l32","l13","l23","l33","l39","l40","l14","l24","l34","l41","l15","l25","l35"],[],[]],["Fuse",["l11","l21","l31"],[],["l42"]],["Bind",["l42"],["blockIdx.x"],[]],["Fuse",["l12","l22","l32"],[],["l43"]],["Bind",["l43"],["vthread.x"],[]],["Fuse",["l13","l23","l33"],[],["l44"]],["Bind",["l44"],["threadIdx.x"],[]],["Annotate",["b0",32],["meta_schedule.thread_extent_low_inclusive"],[]],["Annotate",["b0",1024],["meta_schedule.thread_extent_high_inclusive"],[]],["CacheWrite",["b0"],[0,"local"],["b45"]],["ReverseComputeAt",["b45","l44"],[true],[]],["CacheRead",["b0"],[0,"shared"],["b46"]],["ComputeAt",["b46","l39"],[true],[]],["GetLoops",["b46"],[],["l47","l48","l49","l50","l51","l52","l53"]],["Fuse",["l51","l52","l53"],[],["l54"]],["SampleCategorical",[],[[1,2,3,4],[0.25000000000000000000,0.25000000000000000000,0.25000000000000000000,0.25000000000000000000]],["v55"]],["Annotate",["b46","v55"],["meta_schedule.cooperative_fetch"],[]],["CacheRead",["b0"],[1,"shared"],["b56"]],["ComputeAt",["b56","l39"],[true],[]],["GetLoops",["b56"],[],["l57","l58","l59","l60","l61","l62","l63"]],["Fuse",["l61","l62","l63"],[],["l64"]],["SampleCategorical",[],[[1,2,3,4],[0.25000000000000000000,0.25000000000000000000,0.25000000000000000000,0.25000000000000000000]],["v65"]],["Annotate",["b56","v65"],["meta_schedule.cooperative_fetch"],[]],["Annotate",["l39",[1,1,1]],["software_pipeline_stage"],[]],["Annotate",["l39",[0,1,2]],["software_pipeline_order"],[]],["SampleCategorical",[],[[0,16,64,512,1024],[0.20000000000000001110,0.20000000000000001110,0.20000000000000001110,0.20000000000000001110,0.20000000000000001110]],["v66"]],["Annotate",["b1","v66"],["meta_schedule.unroll_explicit"],[]],["EnterPostproc",[],[],[]],["Unannotate",["b46"],["meta_schedule.cooperative_fetch"],[]],["GetLoops",["b46"],[],["l67","l68","l69","l70","l71"]],["Split",["l71","None",64],[],["l72","l73"]],["Bind",["l73"],["threadIdx.x"],[]],["Unannotate",["b56"],["meta_schedule.cooperative_fetch"],[]],["GetLoops",["b56"],[],["l74","l75","l76","l77","l78"]],["Split",["l78","None",64,2],[],["l79","l80","l81"]],["Vectorize",["l81"],[],[]],["Bind",["l80"],["threadIdx.x"],[]],["GetBlock",[],["root","main"],["b82"]],["Unannotate",["b82"],["meta_schedule.unroll_explicit"],[]],["GetChildBlocks",["b82"],[],["b83","b84","b85","b86"]],["GetLoops",["b83"],[],["l87","l88","l89","l90","l91","l92"]],["GetLoops",["b84"],[],["l93","l94","l95","l96","l97","l98","l99"]],["GetLoops",["b85"],[],["l100","l101","l102","l103","l104","l105","l106","l107","l108","l109","l110","l111"]],["GetLoops",["b86"],[],["l112","l113","l114","l115","l116","l117"]],["GetBlock",[],["Z","main"],["b118"]],["GetLoops",["b118"],[],["l119","l120","l121","l122","l123","l124","l125","l126","l127","l128","l129","l130"]],["DecomposeReduction",["b118","l122"],[],["b131"]]],[[4,[1,1,1,1,1]],[6,[1,32,4,32,1]],[8,[32,2,16,4,1]],[10,[2048,2,1]],[27,2],[33,1],[37,0]]],[0.54238298399999995691],{"arch":"sm_86","keys":["cuda","gpu"],"kind":"cuda","max_num_threads":1024,"max_shared_memory_per_block":49152,"max_threads_per_block":1024,"registers_per_block":65536,"tag":"","thread_warp_size":32},[["TENSOR","float16",[1,4096,4096]],["TENSOR","float16",[1,4096,4096]],["TENSOR","float16",[1,4096,4096]]]]]
[0,[[[["GetBlock",[],["Z","main"],["b0"]],["GetBlock",[],["root","main"],["b1"]],["Annotate",["b0","\"SSSRRSRS\""],["meta_schedule.tiling_structure"],[]],["GetLoops",["b0"],[],["l2","l3","l4","l5"]],["SamplePerfectTile",["l2"],[5,64],["v6","v7","v8","v9","v10"]],["Split",["l2","v6","v7","v8","v9","v10"],[],["l11","l12","l13","l14","l15"]],["SamplePerfectTile",["l3"],[5,64],["v16","v17","v18","v19","v20"]],["Split",["l3","v16","v17","v18","v19","v20"],[],["l21","l22","l23","l24","l25"]],["SamplePerfectTile",["l4"],[5,64],["v26","v27","v28","v29","v30"]],["Split",["l4","v26","v27","v28","v29","v30"],[],["l31","l32","l33","l34","l35"]],["SamplePerfectTile",["l5"],[3,64],["v36","v37","v38"]],["Split",["l5","v36","v37","v38"],[],["l39","l40","l41"]],["Reorder",["l11","l21","l31","l12","l22","l32","l13","l23","l33","l39","l40","l14","l24","l34","l41","l15","l25","l35"],[],[]],["Fuse",["l11","l21","l31"],[],["l42"]],["Bind",["l42"],["blockIdx.x"],[]],["Fuse",["l12","l22","l32"],[],["l43"]],["Bind",["l43"],["vthread.x"],[]],["Fuse",["l13","l23","l33"],[],["l44"]],["Bind",["l44"],["threadIdx.x"],[]],["Annotate",["b0",32],["meta_schedule.thread_extent_low_inclusive"],[]],["Annotate",["b0",1024],["meta_schedule.thread_extent_high_inclusive"],[]],["CacheWrite",["b0"],[0,"local"],["b45"]],["ReverseComputeAt",["b45","l44"],[true],[]],["CacheRead",["b0"],[0,"shared"],["b46"]],["ComputeAt",["b46","l39"],[true],[]],["GetLoops",["b46"],[],["l47","l48","l49","l50","l51","l52","l53"]],["Fuse",["l51","l52","l53"],[],["l54"]],["SampleCategorical",[],[[1,2,3,4],[0.25000000000000000000,0.25000000000000000000,0.25000000000000000000,0.25000000000000000000]],["v55"]],["Annotate",["b46","v55"],["meta_schedule.cooperative_fetch"],[]],["CacheRead",["b0"],[1,"shared"],["b56"]],["ComputeAt",["b56","l39"],[true],[]],["GetLoops",["b56"],[],["l57","l58","l59","l60","l61","l62","l63"]],["Fuse",["l61","l62","l63"],[],["l64"]],["SampleCategorical",[],[[1,2,3,4],[0.25000000000000000000,0.25000000000000000000,0.25000000000000000000,0.25000000000000000000]],["v65"]],["Annotate",["b56","v65"],["meta_schedule.cooperative_fetch"],[]],["Annotate",["l39",[1,1,1]],["software_pipeline_stage"],[]],["Annotate",["l39",[0,1,2]],["software_pipeline_order"],[]],["SampleCategorical",[],[[0,16,64,512,1024],[0.20000000000000001110,0.20000000000000001110,0.20000000000000001110,0.20000000000000001110,0.20000000000000001110]],["v66"]],["Annotate",["b1","v66"],["meta_schedule.unroll_explicit"],[]],["EnterPostproc",[],[],[]],["Unannotate",["b46"],["meta_schedule.cooperative_fetch"],[]],["GetLoops",["b46"],[],["l67","l68","l69","l70","l71"]],["Split",["l71","None",512],[],["l72","l73"]],["Bind",["l73"],["threadIdx.x"],[]],["Unannotate",["b56"],["meta_schedule.cooperative_fetch"],[]],["GetLoops",["b56"],[],["l74","l75","l76","l77","l78"]],["Split",["l78","None",512,4],[],["l79","l80","l81"]],["Vectorize",["l81"],[],[]],["Bind",["l80"],["threadIdx.x"],[]],["GetBlock",[],["root","main"],["b82"]],["Unannotate",["b82"],["meta_schedule.unroll_explicit"],[]],["GetChildBlocks",["b82"],[],["b83","b84","b85","b86"]],["GetLoops",["b83"],[],["l87","l88","l89","l90","l91","l92"]],["GetLoops",["b84"],[],["l93","l94","l95","l96","l97","l98","l99"]],["GetLoops",["b85"],[],["l100","l101","l102","l103","l104","l105","l106","l107","l108","l109","l110","l111"]],["GetLoops",["b86"],[],["l112","l113","l114","l115","l116","l117"]],["GetBlock",[],["Z","main"],["b118"]],["GetLoops",["b118"],[],["l119","l120","l121","l122","l123","l124","l125","l126","l127","l128","l129","l130"]],["DecomposeReduction",["b118","l122"],[],["b131"]]],[[4,[1,1,1,1,1]],[6,[8,1,32,2,8]],[8,[32,1,16,2,4]],[10,[128,4,8]],[27,2],[33,3],[37,0]]],[0.042142222666666673270],{"arch":"sm_86","keys":["cuda","gpu"],"kind":"cuda","max_num_threads":1024,"max_shared_memory_per_block":49152,"max_threads_per_block":1024,"registers_per_block":65536,"tag":"","thread_warp_size":32},[["TENSOR","float16",[1,4096,4096]],["TENSOR","float16",[1,4096,4096]],["TENSOR","float16",[1,4096,4096]]]]]
[0,[[[["GetBlock",[],["Z","main"],["b0"]],["GetBlock",[],["root","main"],["b1"]],["Annotate",["b0","\"SSSRRSRS\""],["meta_schedule.tiling_structure"],[]],["GetLoops",["b0"],[],["l2","l3","l4","l5"]],["SamplePerfectTile",["l2"],[5,64],["v6","v7","v8","v9","v10"]],["Split",["l2","v6","v7","v8","v9","v10"],[],["l11","l12","l13","l14","l15"]],["SamplePerfectTile",["l3"],[5,64],["v16","v17","v18","v19","v20"]],["Split",["l3","v16","v17","v18","v19","v20"],[],["l21","l22","l23","l24","l25"]],["SamplePerfectTile",["l4"],[5,64],["v26","v27","v28","v29","v30"]],["Split",["l4","v26","v27","v28","v29","v30"],[],["l31","l32","l33","l34","l35"]],["SamplePerfectTile",["l5"],[3,64],["v36","v37","v38"]],["Split",["l5","v36","v37","v38"],[],["l39","l40","l41"]],["Reorder",["l11","l21","l31","l12","l22","l32","l13","l23","l33","l39","l40","l14","l24","l34","l41","l15","l25","l35"],[],[]],["Fuse",["l11","l21","l31"],[],["l42"]],["Bind",["l42"],["blockIdx.x"],[]],["Fuse",["l12","l22","l32"],[],["l43"]],["Bind",["l43"],["vthread.x"],[]],["Fuse",["l13","l23","l33"],[],["l44"]],["Bind",["l44"],["threadIdx.x"],[]],["Annotate",["b0",32],["meta_schedule.thread_extent_low_inclusive"],[]],["Annotate",["b0",1024],["meta_schedule.thread_extent_high_inclusive"],[]],["CacheWrite",["b0"],[0,"local"],["b45"]],["ReverseComputeAt",["b45","l44"],[true],[]],["CacheRead",["b0"],[0,"shared"],["b46"]],["ComputeAt",["b46","l39"],[true],[]],["GetLoops",["b46"],[],["l47","l48","l49","l50","l51","l52","l53"]],["Fuse",["l51","l52","l53"],[],["l54"]],["SampleCategorical",[],[[1,2,3,4],[0.25000000000000000000,0.25000000000000000000,0.25000000000000000000,0.25000000000000000000]],["v55"]],["Annotate",["b46","v55"],["meta_schedule.cooperative_fetch"],[]],["CacheRead",["b0"],[1,"shared"],["b56"]],["ComputeAt",["b56","l39"],[true],[]],["GetLoops",["b56"],[],["l57","l58","l59","l60","l61","l62","l63"]],["Fuse",["l61","l62","l63"],[],["l64"]],["SampleCategorical",[],[[1,2,3,4],[0.25000000000000000000,0.25000000000000000000,0.25000000000000000000,0.25000000000000000000]],["v65"]],["Annotate",["b56","v65"],["meta_schedule.cooperative_fetch"],[]],["Annotate",["l39",[1,1,1]],["software_pipeline_stage"],[]],["Annotate",["l39",[0,1,2]],["software_pipeline_order"],[]],["SampleCategorical",[],[[0,16,64,512,1024],[0.20000000000000001110,0.20000000000000001110,0.20000000000000001110,0.20000000000000001110,0.20000000000000001110]],["v66"]],["Annotate",["b1","v66"],["meta_schedule.unroll_explicit"],[]],["EnterPostproc",[],[],[]],["Unannotate",["b46"],["meta_schedule.cooperative_fetch"],[]],["GetLoops",["b46"],[],["l67","l68","l69","l70","l71"]],["Split",["l71","None",64],[],["l72","l73"]],["Bind",["l73"],["threadIdx.x"],[]],["Unannotate",["b56"],["meta_schedule.cooperative_fetch"],[]],["GetLoops",["b56"],[],["l74","l75","l76","l77","l78"]],["Split",["l78","None",64,2],[],["l79","l80","l81"]],["Vectorize",["l81"],[],[]],["Bind",["l80"],["threadIdx.x"],[]],["GetBlock",[],["root","main"],["b82"]],["Unannotate",["b82"],["meta_schedule.unroll_explicit"],[]],["GetChildBlocks",["b82"],[],["b83","b84","b85","b86"]],["GetLoops",["b83"],[],["l87","l88","l89","l90","l91","l92"]],["GetLoops",["b84"],[],["l93","l94","l95","l96","l97","l98","l99"]],["GetLoops",["b85"],[],["l100","l101","l102","l103","l104","l105","l106","l107","l108","l109","l110","l111"]],["GetLoops",["b86"],[],["l112","l113","l114","l115","l116","l117"]],["GetBlock",[],["Z","main"],["b118"]],["GetLoops",["b118"],[],["l119","l120","l121","l122","l123","l124","l125","l126","l127","l128","l129","l130"]],["DecomposeReduction",["b118","l122"],[],["b131"]]],[[4,[1,1,1,1,1]],[6,[4,1,64,1,16]],[8,[16,1,1,8,32]],[10,[1024,2,2]],[27,2],[33,1],[37,0]]],[0.28611994533333334756],{"arch":"sm_86","keys":["cuda","gpu"],"kind":"cuda","max_num_threads":1024,"max_shared_memory_per_block":49152,"max_threads_per_block":1024,"registers_per_block":65536,"tag":"","thread_warp_size":32},[["TENSOR","float16",[1,4096,4096]],["TENSOR","float16",[1,4096,4096]],["TENSOR","float16",[1,4096,4096]]]]]
[0,[[[["GetBlock",[],["Z","main"],["b0"]],["GetBlock",[],["root","main"],["b1"]],["Annotate",["b0","\"SSSRRSRS\""],["meta_schedule.tiling_structure"],[]],["GetLoops",["b0"],[],["l2","l3","l4","l5"]],["SamplePerfectTile",["l2"],[5,64],["v6","v7","v8","v9","v10"]],["Split",["l2","v6","v7","v8","v9","v10"],[],["l11","l12","l13","l14","l15"]],["SamplePerfectTile",["l3"],[5,64],["v16","v17","v18","v19","v20"]],["Split",["l3","v16","v17","v18","v19","v20"],[],["l21","l22","l23","l24","l25"]],["SamplePerfectTile",["l4"],[5,64],["v26","v27","v28","v29","v30"]],["Split",["l4","v26","v27","v28","v29","v30"],[],["l31","l32","l33","l34","l35"]],["SamplePerfectTile",["l5"],[3,64],["v36","v37","v38"]],["Split",["l5","v36","v37","v38"],[],["l39","l40","l41"]],["Reorder",["l11","l21","l31","l12","l22","l32","l13","l23","l33","l39","l40","l14","l24","l34","l41","l15","l25","l35"],[],[]],["Fuse",["l11","l21","l31"],[],["l42"]],["Bind",["l42"],["blockIdx.x"],[]],["Fuse",["l12","l22","l32"],[],["l43"]],["Bind",["l43"],["vthread.x"],[]],["Fuse",["l13","l23","l33"],[],["l44"]],["Bind",["l44"],["threadIdx.x"],[]],["Annotate",["b0",32],["meta_schedule.thread_extent_low_inclusive"],[]],["Annotate",["b0",1024],["meta_schedule.thread_extent_high_inclusive"],[]],["CacheWrite",["b0"],[0,"local"],["b45"]],["ReverseComputeAt",["b45","l44"],[true],[]],["CacheRead",["b0"],[0,"shared"],["b46"]],["ComputeAt",["b46","l39"],[true],[]],["GetLoops",["b46"],[],["l47","l48","l49","l50","l51","l52","l53"]],["Fuse",["l51","l52","l53"],[],["l54"]],["SampleCategorical",[],[[1,2,3,4],[0.25000000000000000000,0.25000000000000000000,0.25000000000000000000,0.25000000000000000000]],["v55"]],["Annotate",["b46","v55"],["meta_schedule.cooperative_fetch"],[]],["CacheRead",["b0"],[1,"shared"],["b56"]],["ComputeAt",["b56","l39"],[true],[]],["GetLoops",["b56"],[],["l57","l58","l59","l60","l61","l62","l63"]],["Fuse",["l61","l62","l63"],[],["l64"]],["SampleCategorical",[],[[1,2,3,4],[0.25000000000000000000,0.25000000000000000000,0.25000000000000000000,0.25000000000000000000]],["v65"]],["Annotate",["b56","v65"],["meta_schedule.cooperative_fetch"],[]],["Annotate",["l39",[1,1,1]],["software_pipeline_stage"],[]],["Annotate",["l39",[0,1,2]],["software_pipeline_order"],[]],["SampleCategorical",[],[[0,16,64,512,1024],[0.20000000000000001110,0.20000000000000001110,0.20000000000000001110,0.20000000000000001110,0.20000000000000001110]],["v66"]],["Annotate",["b1","v66"],["meta_schedule.unroll_explicit"],[]],["EnterPostproc",[],[],[]],["Unannotate",["b46"],["meta_schedule.cooperative_fetch"],[]],["GetLoops",["b46"],[],["l67","l68","l69","l70","l71"]],["Split",["l71","None",128],[],["l72","l73"]],["Bind",["l73"],["threadIdx.x"],[]],["Unannotate",["b56"],["meta_schedule.cooperative_fetch"],[]],["GetLoops",["b56"],[],["l74","l75","l76","l77","l78"]],["Split",["l78","None",128,4],[],["l79","l80","l81"]],["Vectorize",["l81"],[],[]],["Bind",["l80"],["threadIdx.x"],[]],["GetBlock",[],["root","main"],["b82"]],["Unannotate",["b82"],["meta_schedule.unroll_explicit"],[]],["GetChildBlocks",["b82"],[],["b83","b84","b85","b86"]],["GetLoops",["b83"],[],["l87","l88","l89","l90","l91","l92"]],["Annotate",["l87",16],["pragma_auto_unroll_max_step"],[]],["Annotate",["l87",1],["pragma_unroll_explicit"],[]],["GetLoops",["b84"],[],["l93","l94","l95","l96","l97","l98","l99"]],["Annotate",["l93",16],["pragma_auto_unroll_max_step"],[]],["Annotate",["l93",1],["pragma_unroll_explicit"],[]],["GetLoops",["b85"],[],["l100","l101","l102","l103","l104","l105","l106","l107","l108","l109","l110","l111"]],["Annotate",["l100",16],["pragma_auto_unroll_max_step"],[]],["Annotate",["l100",1],["pragma_unroll_explicit"],[]],["GetLoops",["b86"],[],["l112","l113","l114","l115","l116","l117"]],["Annotate",["l112",16],["pragma_auto_unroll_max_step"],[]],["Annotate",["l112",1],["pragma_unroll_explicit"],[]],["GetBlock",[],["Z","main"],["b118"]],["GetLoops",["b118"],[],["l119","l120","l121","l122","l123","l124","l125","l126","l127","l128","l129","l130"]],["DecomposeReduction",["b118","l122"],[],["b131"]]],[[4,[1,1,1,1,1]],[6,[8,8,32,2,1]],[8,[32,1,4,8,4]],[10,[512,8,1]],[27,2],[33,3],[37,1]]],[0.45363646800000001491],{"arch":"sm_86","keys":["cuda","gpu"],"kind":"cuda","max_num_threads":1024,"max_shared_memory_per_block":49152,"max_threads_per_block":1024,"registers_per_block":65536,"tag":"","thread_warp_size":32},[["TENSOR","float16",[1,4096,4096]],["TENSOR","float16",[1,4096,4096]],["TENSOR","float16",[1,4096,4096]]]]]
[0,[[[["GetBlock",[],["Z","main"],["b0"]],["GetBlock",[],["root","main"],["b1"]],["Annotate",["b0","\"SSSRRSRS\""],["meta_schedule.tiling_structure"],[]],["GetLoops",["b0"],[],["l2","l3","l4","l5"]],["SamplePerfectTile",["l2"],[5,64],["v6","v7","v8","v9","v10"]],["Split",["l2","v6","v7","v8","v9","v10"],[],["l11","l12","l13","l14","l15"]],["SamplePerfectTile",["l3"],[5,64],["v16","v17","v18","v19","v20"]],["Split",["l3","v16","v17","v18","v19","v20"],[],["l21","l22","l23","l24","l25"]],["SamplePerfectTile",["l4"],[5,64],["v26","v27","v28","v29","v30"]],["Split",["l4","v26","v27","v28","v29","v30"],[],["l31","l32","l33","l34","l35"]],["SamplePerfectTile",["l5"],[3,64],["v36","v37","v38"]],["Split",["l5","v36","v37","v38"],[],["l39","l40","l41"]],["Reorder",["l11","l21","l31","l12","l22","l32","l13","l23","l33","l39","l40","l14","l24","l34","l41","l15","l25","l35"],[],[]],["Fuse",["l11","l21","l31"],[],["l42"]],["Bind",["l42"],["blockIdx.x"],[]],["Fuse",["l12","l22","l32"],[],["l43"]],["Bind",["l43"],["vthread.x"],[]],["Fuse",["l13","l23","l33"],[],["l44"]],["Bind",["l44"],["threadIdx.x"],[]],["Annotate",["b0",32],["meta_schedule.thread_extent_low_inclusive"],[]],["Annotate",["b0",1024],["meta_schedule.thread_extent_high_inclusive"],[]],["CacheWrite",["b0"],[0,"local"],["b45"]],["ReverseComputeAt",["b45","l44"],[true],[]],["CacheRead",["b0"],[0,"shared"],["b46"]],["ComputeAt",["b46","l39"],[true],[]],["GetLoops",["b46"],[],["l47","l48","l49","l50","l51","l52","l53"]],["Fuse",["l51","l52","l53"],[],["l54"]],["SampleCategorical",[],[[1,2,3,4],[0.25000000000000000000,0.25000000000000000000,0.25000000000000000000,0.25000000000000000000]],["v55"]],["Annotate",["b46","v55"],["meta_schedule.cooperative_fetch"],[]],["CacheRead",["b0"],[1,"shared"],["b56"]],["ComputeAt",["b56","l39"],[true],[]],["GetLoops",["b56"],[],["l57","l58","l59","l60","l61","l62","l63"]],["Fuse",["l61","l62","l63"],[],["l64"]],["SampleCategorical",[],[[1,2,3,4],[0.25000000000000000000,0.25000000000000000000,0.25000000000000000000,0.25000000000000000000]],["v65"]],["Annotate",["b56","v65"],["meta_schedule.cooperative_fetch"],[]],["Annotate",["l39",[1,1,1]],["software_pipeline_stage"],[]],["Annotate",["l39",[0,1,2]],["software_pipeline_order"],[]],["SampleCategorical",[],[[0,16,64,512,1024],[0.20000000000000001110,0.20000000000000001110,0.20000000000000001110,0.20000000000000001110,0.20000000000000001110]],["v66"]],["Annotate",["b1","v66"],["meta_schedule.unroll_explicit"],[]],["EnterPostproc",[],[],[]],["Unannotate",["b46"],["meta_schedule.cooperative_fetch"],[]],["GetLoops",["b46"],[],["l67","l68","l69","l70","l71"]],["Split",["l71","None",128],[],["l72","l73"]],["Bind",["l73"],["threadIdx.x"],[]],["Unannotate",["b56"],["meta_schedule.cooperative_fetch"],[]],["GetLoops",["b56"],[],["l74","l75","l76","l77","l78"]],["Split",["l78","None",128],[],["l79","l80"]],["Bind",["l80"],["threadIdx.x"],[]],["GetBlock",[],["root","main"],["b81"]],["Unannotate",["b81"],["meta_schedule.unroll_explicit"],[]],["GetChildBlocks",["b81"],[],["b82","b83","b84","b85"]],["GetLoops",["b82"],[],["l86","l87","l88","l89","l90","l91"]],["GetLoops",["b83"],[],["l92","l93","l94","l95","l96","l97"]],["GetLoops",["b84"],[],["l98","l99","l100","l101","l102","l103","l104","l105","l106","l107","l108","l109"]],["GetLoops",["b85"],[],["l110","l111","l112","l113","l114","l115"]],["GetBlock",[],["Z","main"],["b116"]],["GetLoops",["b116"],[],["l117","l118","l119","l120","l121","l122","l123","l124","l125","l126","l127","l128"]],["DecomposeReduction",["b116","l120"],[],["b129"]]],[[4,[1,1,1,1,1]],[6,[2,32,8,1,8]],[8,[64,2,16,1,2]],[10,[4096,1,1]],[27,0],[33,2],[37,0]]],[0.55112865433333324550],{"arch":"sm_86","keys":["cuda","gpu"],"kind":"cuda","max_num_threads":1024,"max_shared_memory_per_block":49152,"max_threads_per_block":1024,"registers_per_block":65536,"tag":"","thread_warp_size":32},[["TENSOR","float16",[1,4096,4096]],["TENSOR","float16",[1,4096,4096]],["TENSOR","float16",[1,4096,4096]]]]]
[0,[[[["GetBlock",[],["Z","main"],["b0"]],["GetBlock",[],["root","main"],["b1"]],["Annotate",["b0","\"SSSRRSRS\""],["meta_schedule.tiling_structure"],[]],["GetLoops",["b0"],[],["l2","l3","l4","l5"]],["SamplePerfectTile",["l2"],[5,64],["v6","v7","v8","v9","v10"]],["Split",["l2","v6","v7","v8","v9","v10"],[],["l11","l12","l13","l14","l15"]],["SamplePerfectTile",["l3"],[5,64],["v16","v17","v18","v19","v20"]],["Split",["l3","v16","v17","v18","v19","v20"],[],["l21","l22","l23","l24","l25"]],["SamplePerfectTile",["l4"],[5,64],["v26","v27","v28","v29","v30"]],["Split",["l4","v26","v27","v28","v29","v30"],[],["l31","l32","l33","l34","l35"]],["SamplePerfectTile",["l5"],[3,64],["v36","v37","v38"]],["Split",["l5","v36","v37","v38"],[],["l39","l40","l41"]],["Reorder",["l11","l21","l31","l12","l22","l32","l13","l23","l33","l39","l40","l14","l24","l34","l41","l15","l25","l35"],[],[]],["Fuse",["l11","l21","l31"],[],["l42"]],["Bind",["l42"],["blockIdx.x"],[]],["Fuse",["l12","l22","l32"],[],["l43"]],["Bind",["l43"],["vthread.x"],[]],["Fuse",["l13","l23","l33"],[],["l44"]],["Bind",["l44"],["threadIdx.x"],[]],["Annotate",["b0",32],["meta_schedule.thread_extent_low_inclusive"],[]],["Annotate",["b0",1024],["meta_schedule.thread_extent_high_inclusive"],[]],["CacheWrite",["b0"],[0,"local"],["b45"]],["ReverseComputeAt",["b45","l44"],[true],[]],["CacheRead",["b0"],[0,"shared"],["b46"]],["ComputeAt",["b46","l39"],[true],[]],["GetLoops",["b46"],[],["l47","l48","l49","l50","l51","l52","l53"]],["Fuse",["l51","l52","l53"],[],["l54"]],["SampleCategorical",[],[[1,2,3,4],[0.25000000000000000000,0.25000000000000000000,0.25000000000000000000,0.25000000000000000000]],["v55"]],["Annotate",["b46","v55"],["meta_schedule.cooperative_fetch"],[]],["CacheRead",["b0"],[1,"shared"],["b56"]],["ComputeAt",["b56","l39"],[true],[]],["GetLoops",["b56"],[],["l57","l58","l59","l60","l61","l62","l63"]],["Fuse",["l61","l62","l63"],[],["l64"]],["SampleCategorical",[],[[1,2,3,4],[0.25000000000000000000,0.25000000000000000000,0.25000000000000000000,0.25000000000000000000]],["v65"]],["Annotate",["b56","v65"],["meta_schedule.cooperative_fetch"],[]],["Annotate",["l39",[1,1,1]],["software_pipeline_stage"],[]],["Annotate",["l39",[0,1,2]],["software_pipeline_order"],[]],["SampleCategorical",[],[[0,16,64,512,1024],[0.20000000000000001110,0.20000000000000001110,0.20000000000000001110,0.20000000000000001110,0.20000000000000001110]],["v66"]],["Annotate",["b1","v66"],["meta_schedule.unroll_explicit"],[]],["EnterPostproc",[],[],[]],["Unannotate",["b46"],["meta_schedule.cooperative_fetch"],[]],["GetLoops",["b46"],[],["l67","l68","l69","l70","l71"]],["Split",["l71","None",128],[],["l72","l73"]],["Bind",["l73"],["threadIdx.x"],[]],["Unannotate",["b56"],["meta_schedule.cooperative_fetch"],[]],["GetLoops",["b56"],[],["l74","l75","l76","l77","l78"]],["Split",["l78","None",128],[],["l79","l80"]],["Bind",["l80"],["threadIdx.x"],[]],["GetBlock",[],["root","main"],["b81"]],["Unannotate",["b81"],["meta_schedule.unroll_explicit"],[]],["GetChildBlocks",["b81"],[],["b82","b83","b84","b85"]],["GetLoops",["b82"],[],["l86","l87","l88","l89","l90","l91"]],["Annotate",["l86",1024],["pragma_auto_unroll_max_step"],[]],["Annotate",["l86",1],["pragma_unroll_explicit"],[]],["GetLoops",["b83"],[],["l92","l93","l94","l95","l96","l97"]],["Annotate",["l92",1024],["pragma_auto_unroll_max_step"],[]],["Annotate",["l92",1],["pragma_unroll_explicit"],[]],["GetLoops",["b84"],[],["l98","l99","l100","l101","l102","l103","l104","l105","l106","l107","l108","l109"]],["Annotate",["l98",1024],["pragma_auto_unroll_max_step"],[]],["Annotate",["l98",1],["pragma_unroll_explicit"],[]],["GetLoops",["b85"],[],["l110","l111","l112","l113","l114","l115"]],["Annotate",["l110",1024],["pragma_auto_unroll_max_step"],[]],["Annotate",["l110",1],["pragma_unroll_explicit"],[]],["GetBlock",[],["Z","main"],["b116"]],["GetLoops",["b116"],[],["l117","l118","l119","l120","l121","l122","l123","l124","l125","l126","l127","l128"]],["DecomposeReduction",["b116","l120"],[],["b129"]]],[[4,[1,1,1,1,1]],[6,[2,2,16,32,2]],[8,[1,4,8,128,1]],[10,[1024,1,4]],[27,0],[33,2],[37,4]]],[1.5859506313333335825],{"arch":"sm_86","keys":["cuda","gpu"],"kind":"cuda","max_num_threads":1024,"max_shared_memory_per_block":49152,"max_threads_per_block":1024,"registers_per_block":65536,"tag":"","thread_warp_size":32},[["TENSOR","float16",[1,4096,4096]],["TENSOR","float16",[1,4096,4096]],["TENSOR","float16",[1,4096,4096]]]]]
[0,[[[["GetBlock",[],["Z","main"],["b0"]],["GetBlock",[],["root","main"],["b1"]],["Annotate",["b0","\"SSSRRSRS\""],["meta_schedule.tiling_structure"],[]],["GetLoops",["b0"],[],["l2","l3","l4","l5"]],["SamplePerfectTile",["l2"],[5,64],["v6","v7","v8","v9","v10"]],["Split",["l2","v6","v7","v8","v9","v10"],[],["l11","l12","l13","l14","l15"]],["SamplePerfectTile",["l3"],[5,64],["v16","v17","v18","v19","v20"]],["Split",["l3","v16","v17","v18","v19","v20"],[],["l21","l22","l23","l24","l25"]],["SamplePerfectTile",["l4"],[5,64],["v26","v27","v28","v29","v30"]],["Split",["l4","v26","v27","v28","v29","v30"],[],["l31","l32","l33","l34","l35"]],["SamplePerfectTile",["l5"],[3,64],["v36","v37","v38"]],["Split",["l5","v36","v37","v38"],[],["l39","l40","l41"]],["Reorder",["l11","l21","l31","l12","l22","l32","l13","l23","l33","l39","l40","l14","l24","l34","l41","l15","l25","l35"],[],[]],["Fuse",["l11","l21","l31"],[],["l42"]],["Bind",["l42"],["blockIdx.x"],[]],["Fuse",["l12","l22","l32"],[],["l43"]],["Bind",["l43"],["vthread.x"],[]],["Fuse",["l13","l23","l33"],[],["l44"]],["Bind",["l44"],["threadIdx.x"],[]],["Annotate",["b0",32],["meta_schedule.thread_extent_low_inclusive"],[]],["Annotate",["b0",1024],["meta_schedule.thread_extent_high_inclusive"],[]],["CacheWrite",["b0"],[0,"local"],["b45"]],["ReverseComputeAt",["b45","l44"],[true],[]],["CacheRead",["b0"],[0,"shared"],["b46"]],["ComputeAt",["b46","l39"],[true],[]],["GetLoops",["b46"],[],["l47","l48","l49","l50","l51","l52","l53"]],["Fuse",["l51","l52","l53"],[],["l54"]],["SampleCategorical",[],[[1,2,3,4],[0.25000000000000000000,0.25000000000000000000,0.25000000000000000000,0.25000000000000000000]],["v55"]],["Annotate",["b46","v55"],["meta_schedule.cooperative_fetch"],[]],["CacheRead",["b0"],[1,"shared"],["b56"]],["ComputeAt",["b56","l39"],[true],[]],["GetLoops",["b56"],[],["l57","l58","l59","l60","l61","l62","l63"]],["Fuse",["l61","l62","l63"],[],["l64"]],["SampleCategorical",[],[[1,2,3,4],[0.25000000000000000000,0.25000000000000000000,0.25000000000000000000,0.25000000000000000000]],["v65"]],["Annotate",["b56","v65"],["meta_schedule.cooperative_fetch"],[]],["Annotate",["l39",[1,1,1]],["software_pipeline_stage"],[]],["Annotate",["l39",[0,1,2]],["software_pipeline_order"],[]],["SampleCategorical",[],[[0,16,64,512,1024],[0.20000000000000001110,0.20000000000000001110,0.20000000000000001110,0.20000000000000001110,0.20000000000000001110]],["v66"]],["Annotate",["b1","v66"],["meta_schedule.unroll_explicit"],[]],["EnterPostproc",[],[],[]],["Unannotate",["b46"],["meta_schedule.cooperative_fetch"],[]],["GetLoops",["b46"],[],["l67","l68","l69","l70","l71"]],["Split",["l71","None",128],[],["l72","l73"]],["Bind",["l73"],["threadIdx.x"],[]],["Unannotate",["b56"],["meta_schedule.cooperative_fetch"],[]],["GetLoops",["b56"],[],["l74","l75","l76","l77","l78"]],["Split",["l78","None",128,2],[],["l79","l80","l81"]],["Vectorize",["l81"],[],[]],["Bind",["l80"],["threadIdx.x"],[]],["GetBlock",[],["root","main"],["b82"]],["Unannotate",["b82"],["meta_schedule.unroll_explicit"],[]],["GetChildBlocks",["b82"],[],["b83","b84","b85","b86"]],["GetLoops",["b83"],[],["l87","l88","l89","l90","l91","l92"]],["Annotate",["l87",1024],["pragma_auto_unroll_max_step"],[]],["Annotate",["l87",1],["pragma_unroll_explicit"],[]],["GetLoops",["b84"],[],["l93","l94","l95","l96","l97","l98","l99"]],["Annotate",["l93",1024],["pragma_auto_unroll_max_step"],[]],["Annotate",["l93",1],["pragma_unroll_explicit"],[]],["GetLoops",["b85"],[],["l100","l101","l102","l103","l104","l105","l106","l107","l108","l109","l110","l111"]],["Annotate",["l100",1024],["pragma_auto_unroll_max_step"],[]],["Annotate",["l100",1],["pragma_unroll_explicit"],[]],["GetLoops",["b86"],[],["l112","l113","l114","l115","l116","l117"]],["Annotate",["l112",1024],["pragma_auto_unroll_max_step"],[]],["Annotate",["l112",1],["pragma_unroll_explicit"],[]],["GetBlock",[],["Z","main"],["b118"]],["GetLoops",["b118"],[],["l119","l120","l121","l122","l123","l124","l125","l126","l127","l128","l129","l130"]],["DecomposeReduction",["b118","l122"],[],["b131"]]],[[4,[1,1,1,1,1]],[6,[4,2,2,256,1]],[8,[32,1,64,2,1]],[10,[512,4,2]],[27,2],[33,1],[37,4]]],[0.17660205966666667199],{"arch":"sm_86","keys":["cuda","gpu"],"kind":"cuda","max_num_threads":1024,"max_shared_memory_per_block":49152,"max_threads_per_block":1024,"registers_per_block":65536,"tag":"","thread_warp_size":32},[["TENSOR","float16",[1,4096,4096]],["TENSOR","float16",[1,4096,4096]],["TENSOR","float16",[1,4096,4096]]]]]
[0,[[[["GetBlock",[],["Z","main"],["b0"]],["GetBlock",[],["root","main"],["b1"]],["Annotate",["b0","\"SSSRRSRS\""],["meta_schedule.tiling_structure"],[]],["GetLoops",["b0"],[],["l2","l3","l4","l5"]],["SamplePerfectTile",["l2"],[5,64],["v6","v7","v8","v9","v10"]],["Split",["l2","v6","v7","v8","v9","v10"],[],["l11","l12","l13","l14","l15"]],["SamplePerfectTile",["l3"],[5,64],["v16","v17","v18","v19","v20"]],["Split",["l3","v16","v17","v18","v19","v20"],[],["l21","l22","l23","l24","l25"]],["SamplePerfectTile",["l4"],[5,64],["v26","v27","v28","v29","v30"]],["Split",["l4","v26","v27","v28","v29","v30"],[],["l31","l32","l33","l34","l35"]],["SamplePerfectTile",["l5"],[3,64],["v36","v37","v38"]],["Split",["l5","v36","v37","v38"],[],["l39","l40","l41"]],["Reorder",["l11","l21","l31","l12","l22","l32","l13","l23","l33","l39","l40","l14","l24","l34","l41","l15","l25","l35"],[],[]],["Fuse",["l11","l21","l31"],[],["l42"]],["Bind",["l42"],["blockIdx.x"],[]],["Fuse",["l12","l22","l32"],[],["l43"]],["Bind",["l43"],["vthread.x"],[]],["Fuse",["l13","l23","l33"],[],["l44"]],["Bind",["l44"],["threadIdx.x"],[]],["Annotate",["b0",32],["meta_schedule.thread_extent_low_inclusive"],[]],["Annotate",["b0",1024],["meta_schedule.thread_extent_high_inclusive"],[]],["CacheWrite",["b0"],[0,"local"],["b45"]],["ReverseComputeAt",["b45","l44"],[true],[]],["CacheRead",["b0"],[0,"shared"],["b46"]],["ComputeAt",["b46","l39"],[true],[]],["GetLoops",["b46"],[],["l47","l48","l49","l50","l51","l52","l53"]],["Fuse",["l51","l52","l53"],[],["l54"]],["SampleCategorical",[],[[1,2,3,4],[0.25000000000000000000,0.25000000000000000000,0.25000000000000000000,0.25000000000000000000]],["v55"]],["Annotate",["b46","v55"],["meta_schedule.cooperative_fetch"],[]],["CacheRead",["b0"],[1,"shared"],["b56"]],["ComputeAt",["b56","l39"],[true],[]],["GetLoops",["b56"],[],["l57","l58","l59","l60","l61","l62","l63"]],["Fuse",["l61","l62","l63"],[],["l64"]],["SampleCategorical",[],[[1,2,3,4],[0.25000000000000000000,0.25000000000000000000,0.25000000000000000000,0.25000000000000000000]],["v65"]],["Annotate",["b56","v65"],["meta_schedule.cooperative_fetch"],[]],["Annotate",["l39",[1,1,1]],["software_pipeline_stage"],[]],["Annotate",["l39",[0,1,2]],["software_pipeline_order"],[]],["SampleCategorical",[],[[0,16,64,512,1024],[0.20000000000000001110,0.20000000000000001110,0.20000000000000001110,0.20000000000000001110,0.20000000000000001110]],["v66"]],["Annotate",["b1","v66"],["meta_schedule.unroll_explicit"],[]],["EnterPostproc",[],[],[]],["Unannotate",["b46"],["meta_schedule.cooperative_fetch"],[]],["GetLoops",["b46"],[],["l67","l68","l69","l70","l71"]],["Split",["l71","None",512,2],[],["l72","l73","l74"]],["Vectorize",["l74"],[],[]],["Bind",["l73"],["threadIdx.x"],[]],["Unannotate",["b56"],["meta_schedule.cooperative_fetch"],[]],["GetLoops",["b56"],[],["l75","l76","l77","l78","l79"]],["Split",["l79","None",512,4],[],["l80","l81","l82"]],["Vectorize",["l82"],[],[]],["Bind",["l81"],["threadIdx.x"],[]],["GetBlock",[],["root","main"],["b83"]],["Unannotate",["b83"],["meta_schedule.unroll_explicit"],[]],["GetChildBlocks",["b83"],[],["b84","b85","b86","b87"]],["GetLoops",["b84"],[],["l88","l89","l90","l91","l92","l93","l94"]],["Annotate",["l88",16],["pragma_auto_unroll_max_step"],[]],["Annotate",["l88",1],["pragma_unroll_explicit"],[]],["GetLoops",["b85"],[],["l95","l96","l97","l98","l99","l100","l101"]],["Annotate",["l95",16],["pragma_auto_unroll_max_step"],[]],["Annotate",["l95",1],["pragma_unroll_explicit"],[]],["GetLoops",["b86"],[],["l102","l103","l104","l105","l106","l107","l108","l109","l110","l111","l112","l113"]],["Annotate",["l102",16],["pragma_auto_unroll_max_step"],[]],["Annotate",["l102",1],["pragma_unroll_explicit"],[]],["GetLoops",["b87"],[],["l114","l115","l116","l117","l118","l119"]],["Annotate",["l114",16],["pragma_auto_unroll_max_step"],[]],["Annotate",["l114",1],["pragma_unroll_explicit"],[]],["GetBlock",[],["Z","main"],["b120"]],["GetLoops",["b120"],[],["l121","l122","l123","l124","l125","l126","l127","l128","l129","l130","l131","l132"]],["DecomposeReduction",["b120","l124"],[],["b133"]]],[[4,[1,1,1,1,1]],[6,[32,1,16,8,1]],[8,[16,4,32,2,1]],[10,[64,2,32]],[27,1],[33,3],[37,1]]],[0.12365544966666665305],{"arch":"sm_86","keys":["cuda","gpu"],"kind":"cuda","max_num_threads":1024,"max_shared_memory_per_block":49152,"max_threads_per_block":1024,"registers_per_block":65536,"tag":"","thread_warp_size":32},[["TENSOR","float16",[1,4096,4096]],["TENSOR","float16",[1,4096,4096]],["TENSOR","float16",[1,4096,4096]]]]]
[0,[[[["GetBlock",[],["Z","main"],["b0"]],["GetBlock",[],["root","main"],["b1"]],["Annotate",["b0","\"SSSRRSRS\""],["meta_schedule.tiling_structure"],[]],["GetLoops",["b0"],[],["l2","l3","l4","l5"]],["SamplePerfectTile",["l2"],[5,64],["v6","v7","v8","v9","v10"]],["Split",["l2","v6","v7","v8","v9","v10"],[],["l11","l12","l13","l14","l15"]],["SamplePerfectTile",["l3"],[5,64],["v16","v17","v18","v19","v20"]],["Split",["l3","v16","v17","v18","v19","v20"],[],["l21","l22","l23","l24","l25"]],["SamplePerfectTile",["l4"],[5,64],["v26","v27","v28","v29","v30"]],["Split",["l4","v26","v27","v28","v29","v30"],[],["l31","l32","l33","l34","l35"]],["SamplePerfectTile",["l5"],[3,64],["v36","v37","v38"]],["Split",["l5","v36","v37","v38"],[],["l39","l40","l41"]],["Reorder",["l11","l21","l31","l12","l22","l32","l13","l23","l33","l39","l40","l14","l24","l34","l41","l15","l25","l35"],[],[]],["Fuse",["l11","l21","l31"],[],["l42"]],["Bind",["l42"],["blockIdx.x"],[]],["Fuse",["l12","l22","l32"],[],["l43"]],["Bind",["l43"],["vthread.x"],[]],["Fuse",["l13","l23","l33"],[],["l44"]],["Bind",["l44"],["threadIdx.x"],[]],["Annotate",["b0",32],["meta_schedule.thread_extent_low_inclusive"],[]],["Annotate",["b0",1024],["meta_schedule.thread_extent_high_inclusive"],[]],["CacheWrite",["b0"],[0,"local"],["b45"]],["ReverseComputeAt",["b45","l44"],[true],[]],["CacheRead",["b0"],[0,"shared"],["b46"]],["ComputeAt",["b46","l39"],[true],[]],["GetLoops",["b46"],[],["l47","l48","l49","l50","l51","l52","l53"]],["Fuse",["l51","l52","l53"],[],["l54"]],["SampleCategorical",[],[[1,2,3,4],[0.25000000000000000000,0.25000000000000000000,0.25000000000000000000,0.25000000000000000000]],["v55"]],["Annotate",["b46","v55"],["meta_schedule.cooperative_fetch"],[]],["CacheRead",["b0"],[1,"shared"],["b56"]],["ComputeAt",["b56","l39"],[true],[]],["GetLoops",["b56"],[],["l57","l58","l59","l60","l61","l62","l63"]],["Fuse",["l61","l62","l63"],[],["l64"]],["SampleCategorical",[],[[1,2,3,4],[0.25000000000000000000,0.25000000000000000000,0.25000000000000000000,0.25000000000000000000]],["v65"]],["Annotate",["b56","v65"],["meta_schedule.cooperative_fetch"],[]],["Annotate",["l39",[1,1,1]],["software_pipeline_stage"],[]],["Annotate",["l39",[0,1,2]],["software_pipeline_order"],[]],["SampleCategorical",[],[[0,16,64,512,1024],[0.20000000000000001110,0.20000000000000001110,0.20000000000000001110,0.20000000000000001110,0.20000000000000001110]],["v66"]],["Annotate",["b1","v66"],["meta_schedule.unroll_explicit"],[]],["EnterPostproc",[],[],[]],["Unannotate",["b46"],["meta_schedule.cooperative_fetch"],[]],["GetLoops",["b46"],[],["l67","l68","l69","l70","l71"]],["Split",["l71","None",64],[],["l72","l73"]],["Bind",["l73"],["threadIdx.x"],[]],["Unannotate",["b56"],["meta_schedule.cooperative_fetch"],[]],["GetLoops",["b56"],[],["l74","l75","l76","l77","l78"]],["Split",["l78","None",64,2],[],["l79","l80","l81"]],["Vectorize",["l81"],[],[]],["Bind",["l80"],["threadIdx.x"],[]],["GetBlock",[],["root","main"],["b82"]],["Unannotate",["b82"],["meta_schedule.unroll_explicit"],[]],["GetChildBlocks",["b82"],[],["b83","b84","b85","b86"]],["GetLoops",["b83"],[],["l87","l88","l89","l90","l91","l92"]],["GetLoops",["b84"],[],["l93","l94","l95","l96","l97","l98","l99"]],["GetLoops",["b85"],[],["l100","l101","l102","l103","l104","l105","l106","l107","l108","l109","l110","l111"]],["GetLoops",["b86"],[],["l112","l113","l114","l115","l116","l117"]],["GetBlock",[],["Z","main"],["b118"]],["GetLoops",["b118"],[],["l119","l120","l121","l122","l123","l124","l125","l126","l127","l128","l129","l130"]],["DecomposeReduction",["b118","l122"],[],["b131"]]],[[4,[1,1,1,1,1]],[6,[1,16,4,64,1]],[8,[32,2,16,4,1]],[10,[4096,1,1]],[27,2],[33,1],[37,0]]],[0.54313619299999993384],{"arch":"sm_86","keys":["cuda","gpu"],"kind":"cuda","max_num_threads":1024,"max_shared_memory_per_block":49152,"max_threads_per_block":1024,"registers_per_block":65536,"tag":"","thread_warp_size":32},[["TENSOR","float16",[1,4096,4096]],["TENSOR","float16",[1,4096,4096]],["TENSOR","float16",[1,4096,4096]]]]]
[0,[[[["GetBlock",[],["Z","main"],["b0"]],["GetBlock",[],["root","main"],["b1"]],["Annotate",["b0","\"SSSRRSRS\""],["meta_schedule.tiling_structure"],[]],["GetLoops",["b0"],[],["l2","l3","l4","l5"]],["SamplePerfectTile",["l2"],[5,64],["v6","v7","v8","v9","v10"]],["Split",["l2","v6","v7","v8","v9","v10"],[],["l11","l12","l13","l14","l15"]],["SamplePerfectTile",["l3"],[5,64],["v16","v17","v18","v19","v20"]],["Split",["l3","v16","v17","v18","v19","v20"],[],["l21","l22","l23","l24","l25"]],["SamplePerfectTile",["l4"],[5,64],["v26","v27","v28","v29","v30"]],["Split",["l4","v26","v27","v28","v29","v30"],[],["l31","l32","l33","l34","l35"]],["SamplePerfectTile",["l5"],[3,64],["v36","v37","v38"]],["Split",["l5","v36","v37","v38"],[],["l39","l40","l41"]],["Reorder",["l11","l21","l31","l12","l22","l32","l13","l23","l33","l39","l40","l14","l24","l34","l41","l15","l25","l35"],[],[]],["Fuse",["l11","l21","l31"],[],["l42"]],["Bind",["l42"],["blockIdx.x"],[]],["Fuse",["l12","l22","l32"],[],["l43"]],["Bind",["l43"],["vthread.x"],[]],["Fuse",["l13","l23","l33"],[],["l44"]],["Bind",["l44"],["threadIdx.x"],[]],["Annotate",["b0",32],["meta_schedule.thread_extent_low_inclusive"],[]],["Annotate",["b0",1024],["meta_schedule.thread_extent_high_inclusive"],[]],["CacheWrite",["b0"],[0,"local"],["b45"]],["ReverseComputeAt",["b45","l44"],[true],[]],["CacheRead",["b0"],[0,"shared"],["b46"]],["ComputeAt",["b46","l39"],[true],[]],["GetLoops",["b46"],[],["l47","l48","l49","l50","l51","l52","l53"]],["Fuse",["l51","l52","l53"],[],["l54"]],["SampleCategorical",[],[[1,2,3,4],[0.25000000000000000000,0.25000000000000000000,0.25000000000000000000,0.25000000000000000000]],["v55"]],["Annotate",["b46","v55"],["meta_schedule.cooperative_fetch"],[]],["CacheRead",["b0"],[1,"shared"],["b56"]],["ComputeAt",["b56","l39"],[true],[]],["GetLoops",["b56"],[],["l57","l58","l59","l60","l61","l62","l63"]],["Fuse",["l61","l62","l63"],[],["l64"]],["SampleCategorical",[],[[1,2,3,4],[0.25000000000000000000,0.25000000000000000000,0.25000000000000000000,0.25000000000000000000]],["v65"]],["Annotate",["b56","v65"],["meta_schedule.cooperative_fetch"],[]],["Annotate",["l39",[1,1,1]],["software_pipeline_stage"],[]],["Annotate",["l39",[0,1,2]],["software_pipeline_order"],[]],["SampleCategorical",[],[[0,16,64,512,1024],[0.20000000000000001110,0.20000000000000001110,0.20000000000000001110,0.20000000000000001110,0.20000000000000001110]],["v66"]],["Annotate",["b1","v66"],["meta_schedule.unroll_explicit"],[]],["EnterPostproc",[],[],[]],["Unannotate",["b46"],["meta_schedule.cooperative_fetch"],[]],["GetLoops",["b46"],[],["l67","l68","l69","l70","l71"]],["Split",["l71","None",32,4],[],["l72","l73","l74"]],["Vectorize",["l74"],[],[]],["Bind",["l73"],["threadIdx.x"],[]],["Unannotate",["b56"],["meta_schedule.cooperative_fetch"],[]],["GetLoops",["b56"],[],["l75","l76","l77","l78","l79"]],["Split",["l79","None",32,4],[],["l80","l81","l82"]],["Vectorize",["l82"],[],[]],["Bind",["l81"],["threadIdx.x"],[]],["GetBlock",[],["root","main"],["b83"]],["Unannotate",["b83"],["meta_schedule.unroll_explicit"],[]],["GetChildBlocks",["b83"],[],["b84","b85","b86","b87"]],["GetLoops",["b84"],[],["l88","l89","l90","l91","l92","l93","l94"]],["Annotate",["l88",512],["pragma_auto_unroll_max_step"],[]],["Annotate",["l88",1],["pragma_unroll_explicit"],[]],["GetLoops",["b85"],[],["l95","l96","l97","l98","l99","l100","l101"]],["Annotate",["l95",512],["pragma_auto_unroll_max_step"],[]],["Annotate",["l95",1],["pragma_unroll_explicit"],[]],["GetLoops",["b86"],[],["l102","l103","l104","l105","l106","l107","l108","l109","l110","l111","l112","l113"]],["Annotate",["l102",512],["pragma_auto_unroll_max_step"],[]],["Annotate",["l102",1],["pragma_unroll_explicit"],[]],["GetLoops",["b87"],[],["l114","l115","l116","l117","l118","l119"]],["Annotate",["l114",512],["pragma_auto_unroll_max_step"],[]],["Annotate",["l114",1],["pragma_unroll_explicit"],[]],["GetBlock",[],["Z","main"],["b120"]],["GetLoops",["b120"],[],["l121","l122","l123","l124","l125","l126","l127","l128","l129","l130","l131","l132"]],["DecomposeReduction",["b120","l124"],[],["b133"]]],[[4,[1,1,1,1,1]],[6,[2,32,4,1,16]],[8,[16,4,8,8,1]],[10,[1024,4,1]],[27,3],[33,3],[37,3]]],[1.1178409819999999275],{"arch":"sm_86","keys":["cuda","gpu"],"kind":"cuda","max_num_threads":1024,"max_shared_memory_per_block":49152,"max_threads_per_block":1024,"registers_per_block":65536,"tag":"","thread_warp_size":32},[["TENSOR","float16",[1,4096,4096]],["TENSOR","float16",[1,4096,4096]],["TENSOR","float16",[1,4096,4096]]]]]
[0,[[[["GetBlock",[],["Z","main"],["b0"]],["GetBlock",[],["root","main"],["b1"]],["Annotate",["b0","\"SSSRRSRS\""],["meta_schedule.tiling_structure"],[]],["GetLoops",["b0"],[],["l2","l3","l4","l5"]],["SamplePerfectTile",["l2"],[5,64],["v6","v7","v8","v9","v10"]],["Split",["l2","v6","v7","v8","v9","v10"],[],["l11","l12","l13","l14","l15"]],["SamplePerfectTile",["l3"],[5,64],["v16","v17","v18","v19","v20"]],["Split",["l3","v16","v17","v18","v19","v20"],[],["l21","l22","l23","l24","l25"]],["SamplePerfectTile",["l4"],[5,64],["v26","v27","v28","v29","v30"]],["Split",["l4","v26","v27","v28","v29","v30"],[],["l31","l32","l33","l34","l35"]],["SamplePerfectTile",["l5"],[3,64],["v36","v37","v38"]],["Split",["l5","v36","v37","v38"],[],["l39","l40","l41"]],["Reorder",["l11","l21","l31","l12","l22","l32","l13","l23","l33","l39","l40","l14","l24","l34","l41","l15","l25","l35"],[],[]],["Fuse",["l11","l21","l31"],[],["l42"]],["Bind",["l42"],["blockIdx.x"],[]],["Fuse",["l12","l22","l32"],[],["l43"]],["Bind",["l43"],["vthread.x"],[]],["Fuse",["l13","l23","l33"],[],["l44"]],["Bind",["l44"],["threadIdx.x"],[]],["Annotate",["b0",32],["meta_schedule.thread_extent_low_inclusive"],[]],["Annotate",["b0",1024],["meta_schedule.thread_extent_high_inclusive"],[]],["CacheWrite",["b0"],[0,"local"],["b45"]],["ReverseComputeAt",["b45","l44"],[true],[]],["CacheRead",["b0"],[0,"shared"],["b46"]],["ComputeAt",["b46","l39"],[true],[]],["GetLoops",["b46"],[],["l47","l48","l49","l50","l51","l52","l53"]],["Fuse",["l51","l52","l53"],[],["l54"]],["SampleCategorical",[],[[1,2,3,4],[0.25000000000000000000,0.25000000000000000000,0.25000000000000000000,0.25000000000000000000]],["v55"]],["Annotate",["b46","v55"],["meta_schedule.cooperative_fetch"],[]],["CacheRead",["b0"],[1,"shared"],["b56"]],["ComputeAt",["b56","l39"],[true],[]],["GetLoops",["b56"],[],["l57","l58","l59","l60","l61","l62","l63"]],["Fuse",["l61","l62","l63"],[],["l64"]],["SampleCategorical",[],[[1,2,3,4],[0.25000000000000000000,0.25000000000000000000,0.25000000000000000000,0.25000000000000000000]],["v65"]],["Annotate",["b56","v65"],["meta_schedule.cooperative_fetch"],[]],["Annotate",["l39",[1,1,1]],["software_pipeline_stage"],[]],["Annotate",["l39",[0,1,2]],["software_pipeline_order"],[]],["SampleCategorical",[],[[0,16,64,512,1024],[0.20000000000000001110,0.20000000000000001110,0.20000000000000001110,0.20000000000000001110,0.20000000000000001110]],["v66"]],["Annotate",["b1","v66"],["meta_schedule.unroll_explicit"],[]],["EnterPostproc",[],[],[]],["Unannotate",["b46"],["meta_schedule.cooperative_fetch"],[]],["GetLoops",["b46"],[],["l67","l68","l69","l70","l71"]],["Split",["l71","None",64],[],["l72","l73"]],["Bind",["l73"],["threadIdx.x"],[]],["Unannotate",["b56"],["meta_schedule.cooperative_fetch"],[]],["GetLoops",["b56"],[],["l74","l75","l76","l77","l78"]],["Split",["l78","None",64],[],["l79","l80"]],["Bind",["l80"],["threadIdx.x"],[]],["GetBlock",[],["root","main"],["b81"]],["Unannotate",["b81"],["meta_schedule.unroll_explicit"],[]],["GetChildBlocks",["b81"],[],["b82","b83","b84","b85"]],["GetLoops",["b82"],[],["l86","l87","l88","l89","l90","l91"]],["GetLoops",["b83"],[],["l92","l93","l94","l95","l96","l97"]],["GetLoops",["b84"],[],["l98","l99","l100","l101","l102","l103","l104","l105","l106","l107","l108","l109"]],["GetLoops",["b85"],[],["l110","l111","l112","l113","l114","l115"]],["GetBlock",[],["Z","main"],["b116"]],["GetLoops",["b116"],[],["l117","l118","l119","l120","l121","l122","l123","l124","l125","l126","l127","l128"]],["DecomposeReduction",["b116","l120"],[],["b129"]]],[[4,[1,1,1,1,1]],[6,[2,1,32,32,2]],[8,[8,16,2,4,4]],[10,[1024,4,1]],[27,0],[33,0],[37,0]]],[0.92549495833333328410],{"arch":"sm_86","keys":["cuda","gpu"],"kind":"cuda","max_num_threads":1024,"max_shared_memory_per_block":49152,"max_threads_per_block":1024,"registers_per_block":65536,"tag":"","thread_warp_size":32},[["TENSOR","float16",[1,4096,4096]],["TENSOR","float16",[1,4096,4096]],["TENSOR","float16",[1,4096,4096]]]]]
