autobench-main/results/RTX3090/workloads/batch_size_1_GEMM-4096-4096-4096_cutlass_input_f16_acc_f16_output_f16/GEMM-4096-4096-4096-1-f16-f16.csv
Problem,Provider,OperationKind,Operation,Disposition,Status,gemm_kind,split_k_mode,m,n,k,A,B,C,alpha,beta,split_k_slices,batch_count,op_class,accum,cta_m,cta_n,cta_k,stages,warps_m,warps_n,warps_k,inst_m,inst_n,inst_k,min_cc,max_cc,Bytes,Flops,Flops/Byte,Runtime,GB/s,GFLOPs
1,CUTLASS,gemm,cutlass_simt_hgemm_256x128_8x2_tn_align1,incorrect,success,universal,serial,4096,4096,4096,f16:row,f16:column,f16:column,1,0,1,1,simt,f16,256,128,8,2,4,2,1,1,1,1,50,1024,100663296,137472507904,1365,4.64351,20.1895,29605.3
1,CUTLASS,gemm,cutlass_tensorop_h1688gemm_256x128_32x2_tn_align8,incorrect,success,universal,serial,4096,4096,4096,f16:row,f16:column,f16:column,1,0,1,1,tensorop,f16,256,128,32,2,4,2,1,16,8,8,75,1024,100663296,137472507904,1365,1.28587,72.908,106910
1,CUTLASS,gemm,cutlass_tensorop_h16816gemm_256x128_32x3_tn_align8,incorrect,success,universal,serial,4096,4096,4096,f16:row,f16:column,f16:column,1,0,1,1,tensorop,f16,256,128,32,3,4,2,1,16,8,16,80,1024,100663296,137472507904,1365,1.07633,87.1018,127724
